 ID,Name / Nom,Latitude,Longitude,Prov/Terr,Timezone / Fuseau horaire
04LM001,"MISSINAIBI RIVER BELOW WABOOSE RIVER",50.585560,-82.091110,ON,UTC-05:00
04MB002,"DRIFTWOOD RIVER at MONTEITH",48.644580,-80.674810,ON,UTC-05:00
04MB005,"WATABEAG LAKE AT WATABEAG LAKE DAM",48.292890,-80.544890,ON,UTC-05:00
04MD004,"PORCUPINE RIVER AT HOYLE",48.556110,-81.056940,ON,UTC-05:00
04MD005,"PORCUPINE LAKE NEAR PORCUPINE",48.478330,-81.190280,ON,UTC-05:00
04ME003,"ABITIBI RIVER AT ONAKAWANA",50.602920,-81.414640,ON,UTC-05:00
04ME005,"NEWPOST CREEK NEAR THE MOUTH",49.972030,-81.512030,ON,UTC-05:00
04MF001,"NORTH FRENCH RIVER NEAR THE MOUTH",51.076670,-80.764170,ON,UTC-05:00
05AA004,"PINCHER CREEK AT PINCHER CREEK",49.486400,-113.947690,AB,UTC-07:00
05AA008,"CROWSNEST RIVER AT FRANK",49.596944,-114.409166,AB,UTC-07:00
05AA011,"MILL CREEK NEAR THE MOUTH",49.469440,-114.133000,AB,UTC-07:00
05AA022,"CASTLE RIVER NEAR BEAVER MINES",49.488330,-114.144400,AB,UTC-07:00
05AA024,"OLDMAN RIVER NEAR BROCKET",49.557500,-113.822200,AB,UTC-07:00
05AA027,"RACEHORSE CREEK NEAR THE MOUTH",49.837790,-114.420590,AB,UTC-07:00
05AA028,"CASTLE RIVER AT RANGER STATION",49.398610,-114.338900,AB,UTC-07:00
05AA030,"GOLD CREEK NEAR FRANK",49.602220,-114.400000,AB,UTC-07:00
05AA032,"OLDMAN RESERVOIR NEAR PINCHER CREEK",49.612040,-114.053280,AB,UTC-07:00
05AA033,"KETTLES CREEK AT PINCHER CREEK",49.492320,-113.926510,AB,UTC-07:00
05AA034,"PINCHER CREEK AT FRONT RANGE ROAD",49.309340,-114.075100,AB,UTC-07:00
05AA035,"OLDMAN RIVER AT RANGE ROAD NO. 13A",49.727690,-114.086490,AB,UTC-07:00
05AB005,"TROUT CREEK NEAR GRANUM",49.976390,-113.685280,AB,UTC-07:00
05AB019,"LETHBRIDGE NORTHERN IRRIGATION DISTRICT CANAL ABOVE OLDMAN FLUME",49.687060,-113.576920,AB,UTC-07:00
05AB021,"WILLOW CREEK NEAR CLARESHOLM",50.018050,-113.713900,AB,UTC-07:00
05AB029,"MEADOW CREEK NEAR THE MOUTH",49.951390,-113.661900,AB,UTC-07:00
05AB037,"CHAIN LAKES RESERVOIR NEAR NANTON",50.201390,-114.189400,AB,UTC-07:00
05AB040,"WILLOW CREEK AT SECONDARY NO. 532",50.241390,-114.347800,AB,UTC-07:00
05AB041,"WILLOW CREEK AT OXLY RANCH",50.128890,-113.845000,AB,UTC-07:00
05AB042,"PINE COULEE DIVERSION CANAL BELOW HEAD GATES",50.128060,-113.787200,AB,UTC-07:00
05AB044,"PINE COULEE RESERVOIR NEAR STAVELY",50.121940,-113.748100,AB,UTC-07:00
05AB045,"PINE COULEE OUTFLOW BELOW RESERVOIR",50.120280,-113.749700,AB,UTC-07:00
05AC003,"LITTLE BOW RIVER AT CARMANGAY",50.127500,-113.117200,AB,UTC-07:00
05AC017,"LOMOND LATERAL NEAR HEADGATE",50.213890,-112.661100,AB,UTC-07:00
05AC023,"LITTLE BOW RIVER NEAR THE MOUTH",49.900000,-112.505600,AB,UTC-07:00
05AC031,"MOSQUITO CREEK NEAR THE MOUTH",50.255550,-113.554200,AB,UTC-07:00
05AD003,"WATERTON RIVER NEAR WATERTON PARK",49.113890,-113.838900,AB,UTC-07:00
05AD005,"BELLY RIVER NEAR MOUNTAIN VIEW",49.099450,-113.696100,AB,UTC-07:00
05AD007,"OLDMAN RIVER NEAR LETHBRIDGE",49.708330,-112.875000,AB,UTC-07:00
05AD010,"DRYWOOD CREEK NEAR THE MOUTH",49.293890,-113.793100,AB,UTC-07:00
05AD013,"UNITED IRRIGATION DISTRICT CANAL NEAR HILL SPRING",49.217777,-113.632222,AB,UTC-07:00
05AD017,"MOUNTAIN VIEW IRRIGATION DISTRICT CANAL",49.433333,-113.691666,AB,UTC-07:00
05AD021,"BELLY - ST. MARY DIVERSION CANAL",49.336110,-113.551940,AB,UTC-07:00
05AD025,"WATERTON LAKE AT WATERTON PARK",49.055833,-113.908888,AB,UTC-07:00
05AD026,"WATERTON RESERVOIR",49.321670,-113.681100,AB,UTC-07:00
05AD027,"WATERTON - BELLY DIVERSION CANAL",49.327030,-113.633830,AB,UTC-07:00
05AD028,"WATERTON RIVER NEAR GLENWOOD",49.443060,-113.469400,AB,UTC-07:00
05AD035,"PRAIRIE BLOOD COULEE NEAR LETHBRIDGE",49.563890,-112.958900,AB,UTC-07:00
05AD041,"BELLY RIVER NEAR GLENWOOD",49.352220,-113.480300,AB,UTC-07:00
05AD042,"YARROW CREEK AT SPREAD EAGLE ROAD",49.231940,-113.960780,AB,UTC-07:00
05AE002,"LEE CREEK AT CARDSTON",49.200000,-113.295800,AB,UTC-07:00
05AE006,"ST. MARY RIVER NEAR LETHBRIDGE",49.573330,-112.844170,AB,UTC-07:00
05AE016,"POTHOLE CREEK AT RUSSELL'S RANCH",49.564440,-112.816700,AB,UTC-07:00
05AE025,"ST. MARY RESERVOIR NEAR SPRING COULEE",49.362780,-113.116100,AB,UTC-07:00
05AE026,"CANADIAN ST. MARY CANAL NEAR SPRING COULEE",49.343630,-113.043530,AB,UTC-07:00
05AE043,"ST. MARY RIVER AT HIGHWAY NO. 501",49.091670,-113.220600,AB,UTC-07:00
05AF030,"MILK RIVER RIDGE RESERVOIR",49.383340,-112.594200,AB,UTC-07:00
05AF033,"MANYBERRIES CREEK AT RANGE ROAD NO. 63",49.318900,-110.745600,AB,UTC-07:00
05AG003,"EXPANSE COULEE NEAR THE MOUTH",49.988330,-112.083300,AB,UTC-07:00
05AG006,"OLDMAN RIVER NEAR THE MOUTH",49.918890,-111.800000,AB,UTC-07:00
05AH005,"SEVEN PERSONS CREEK AT MEDICINE HAT",50.023611,-110.683888,AB,UTC-07:00
05AH025,"ELKWATER LAKE AT ELKWATER",49.662220,-110.286100,AB,UTC-07:00
05AH037,"GROS VENTRE CREEK NEAR DUNMORE",49.888890,-110.505600,AB,UTC-07:00
05AH041,"PEIGAN CREEK NEAR PAKOWKI ROAD",49.580550,-110.941700,AB,UTC-07:00
05AH043,"EAST MCALPINE CREEK NEAR ELKWATER LAKE",49.794570,-110.186550,AB,UTC-07:00
05AH047,"SAM LAKE TRIBUTARY NEAR SCHULER",50.163330,-110.260300,AB,UTC-07:00
05AH048,"CAVAN LAKE NEAR DUNMORE",49.943890,-110.399400,AB,UTC-07:00
05AH050,"BOXELDER CREEK AT HARGRAVE'S RANCH",50.011940,-109.987200,AB,UTC-07:00
05AH052,"ROSS CREEK AT HIGHWAY NO. 41",50.005550,-110.530600,AB,UTC-07:00
05AH053,"BULLSHEAD CREEK AT BLACK AND WHITE TRAIL",49.915888,-110.648333,AB,UTC-07:00
05AH054,"CYPRESS VIEW RESERVOIR NEAR ELKWATER",49.837500,-110.162500,AB,UTC-07:00
05AH055,"MCALPINE CREEK RESERVOIR NEAR ELKWATER",49.801110,-110.128900,AB,UTC-07:00
05AH056,"MACKAY CREEK RESERVOIR NEAR ELKWATER",49.715280,-110.128600,AB,UTC-07:00
05AH057,"BULLSHEAD RESERVOIR NEAR ELKWATER",49.677780,-110.516400,AB,UTC-07:00
05AH058,"SPRUCE COULEE RESERVOIR NEAR ELKWATER",49.679170,-110.182800,AB,UTC-07:00
05AJ001,"SOUTH SASKATCHEWAN RIVER AT MEDICINE HAT",50.043060,-110.677800,AB,UTC-07:00
05BA001,"BOW RIVER AT LAKE LOUISE",51.428300,-116.187500,AB,UTC-07:00
05BA002,"PIPESTONE RIVER NEAR LAKE LOUISE",51.433890,-116.172220,AB,UTC-07:00
05BB001,"BOW RIVER AT BANFF",51.175000,-115.569400,AB,UTC-07:00
05BC001,"SPRAY RIVER AT BANFF",51.159700,-115.554400,AB,UTC-07:00
05BG006,"WAIPAROUS CREEK NEAR THE MOUTH",51.282780,-114.837500,AB,UTC-07:00
05BG010,"GHOST RIVER ABOVE WAIPAROUS CREEK",51.270830,-114.921670,AB,UTC-07:00
05BH004,"BOW RIVER AT CALGARY",51.050000,-114.050000,AB,UTC-07:00
05BH005,"BOW RIVER NEAR COCHRANE",51.172780,-114.466700,AB,UTC-07:00
05BH013,"JUMPINGPOUND CREEK NEAR COX HILL",51.002330,-114.938140,AB,UTC-07:00
05BH014,"NOSE CREEK ABOVE AIRDRIE",51.311940,-114.027500,AB,UTC-07:00
05BH015,"JUMPINGPOUND CREEK AT TOWNSHIP ROAD NO. 252",51.127930,-114.566860,AB,UTC-07:00
05BH016,"WEST NOSE CREEK AT CALGARY",51.190120,-114.141230,AB,UTC-07:00
05BJ001,"ELBOW RIVER BELOW GLENMORE DAM",51.015280,-114.092500,AB,UTC-07:00
05BJ004,"ELBOW RIVER at BRAGG CREEK",50.948050,-114.569400,AB,UTC-07:00
05BJ010,"ELBOW RIVER AT SARCEE BRIDGE",50.994920,-114.164900,AB,UTC-07:00
05BK001,"FISH CREEK NEAR PRIDDIS",50.886110,-114.326400,AB,UTC-07:00
05BL004,"HIGHWOOD RIVER BELOW LITTLE BOW CANAL",50.585560,-113.868600,AB,UTC-07:00
05BL007,"STIMSON CREEK NEAR PEKISKO",50.430560,-114.165300,AB,UTC-07:00
05BL012,"SHEEP RIVER AT OKOTOKS",50.721400,-113.980800,AB,UTC-07:00
05BL013,"THREEPOINT CREEK NEAR MILLARVILLE",50.771110,-114.277500,AB,UTC-07:00
05BL014,"SHEEP RIVER AT BLACK DIAMOND",50.687220,-114.242800,AB,UTC-07:00
05BL015,"LITTLE BOW CANAL AT HIGH RIVER",50.582780,-113.868900,AB,UTC-07:00
05BL019,"HIGHWOOD RIVER AT DIEBEL'S RANCH",50.405560,-114.497200,AB,UTC-07:00
05BL022,"CATARACT CREEK NEAR FORESTRY ROAD",50.284440,-114.590300,AB,UTC-07:00
05BL023,"PEKISKO CREEK NEAR LONGVIEW",50.473890,-114.205600,AB,UTC-07:00
05BL024,"HIGHWOOD RIVER NEAR THE MOUTH",50.783330,-113.820300,AB,UTC-07:00
05BL025,"HIGHWOOD DIVERSION CANAL NEAR HEADGATES",50.552220,-113.988900,AB,UTC-07:00
05BL027,"TRAP CREEK NEAR LONGVIEW",50.476670,-114.424400,AB,UTC-07:00
05BM002,"BOW RIVER BELOW CARSELAND DAM",50.823890,-113.441900,AB,UTC-07:00
05BM004,"BOW RIVER BELOW BASSANO DAM",50.750000,-112.538900,AB,UTC-07:00
05BM008,"CROWFOOT CREEK NEAR CLUNY",50.833330,-112.761100,AB,UTC-07:00
05BM014,"WEST ARROWWOOD CREEK NEAR ARROWWOOD",50.764040,-113.236310,AB,UTC-07:00
05BM015,"WESTERN IRRIGATION DISTRICT CANAL NEAR HEADGATES",51.043060,-114.008300,AB,UTC-07:00
05BM020,"EASTERN IRRIGATION DISTRICT MAIN BRANCH CANAL NEAR HEADGATE",50.745830,-112.516700,AB,UTC-07:00
05BM021,"BOW RIVER DEVELOPMENT MAIN CANAL BELOW HEADGATES",50.825830,-113.430000,AB,UTC-07:00
05BN002,"TWELVE MILE CREEK NEAR CECIL",50.150000,-111.666667,AB,UTC-07:00
05BN006,"NEW WEST COULEE NEAR THE MOUTH",50.216667,-112.104167,AB,UTC-07:00
05BN012,"BOW RIVER NEAR THE MOUTH",50.046390,-111.591100,AB,UTC-07:00
05CA002,"JAMES RIVER NEAR SUNDRE",51.926940,-114.684400,AB,UTC-07:00
05CA004,"RED DEER RIVER ABOVE PANTHER RIVER",51.659440,-115.409700,AB,UTC-07:00
05CA009,"RED DEER RIVER BELOW BURNT TIMBER CREEK",51.646110,-115.018100,AB,UTC-07:00
05CA011,"BEARBERRY CREEK NEAR SUNDRE",51.800278,-114.653056,AB,UTC-07:00
05CA012,"FALLENTIMBER CREEK NEAR SUNDRE",51.736666,-114.655000,AB,UTC-07:00
05CB001,"LITTLE RED DEER RIVER NEAR THE MOUTH",52.027780,-114.138900,AB,UTC-07:00
05CB002,"LITTLE RED DEER RIVER NEAR WATER VALLEY",51.511390,-114.671940,AB,UTC-07:00
05CB004,"RAVEN RIVER NEAR RAVEN",52.088890,-114.476400,AB,UTC-07:00
05CB006,"GLENIFFER RESERVOIR NEAR DICKSON",52.046390,-114.227500,AB,UTC-07:00
05CB007,"DICKSON DAM TUNNEL OUTLET",52.058330,-114.217200,AB,UTC-07:00
05CC001,"BLINDMAN RIVER NEAR BLACKFALDS",52.353890,-113.793100,AB,UTC-07:00
05CC002,"RED DEER RIVER AT RED DEER",52.276670,-113.815800,AB,UTC-07:00
05CC003,"SYLVAN LAKE AT SYLVAN LAKE",52.311333,-114.103350,AB,UTC-07:00
05CC006,"GULL LAKE AT RV HEAVEN MARINA",52.596366,-114.056166,AB,UTC-07:00
05CC007,"MEDICINE RIVER NEAR ECKVILLE",52.318890,-114.342500,AB,UTC-07:00
05CC008,"BLINDMAN RIVER NEAR BLUFFTON",52.756110,-114.284200,AB,UTC-07:00
05CC011,"WASKASOO CREEK AT RED DEER",52.268500,-113.799950,AB,UTC-07:00
05CC013,"LASTHILL CREEK NEAR ECKVILLE",52.361833,-114.457388,AB,UTC-07:00
05CD005,"BUFFALO LAKE NEAR ERSKINE",52.457220,-112.876700,AB,UTC-07:00
05CD006,"HAYNES CREEK NEAR HAYNES",52.331940,-113.361100,AB,UTC-07:00
05CD007,"PARLBY CREEK AT ALIX",52.407500,-113.195278,AB,UTC-07:00
05CE001,"RED DEER RIVER AT DRUMHELLER",51.467470,-112.711600,AB,UTC-07:00
05CE002,"KNEEHILLS CREEK NEAR DRUMHELLER",51.470000,-112.976900,AB,UTC-07:00
05CE005,"ROSEBUD RIVER AT REDLAND",51.293330,-113.010600,AB,UTC-07:00
05CE006,"ROSEBUD RIVER BELOW CARSTAIRS CREEK",51.415830,-113.727780,AB,UTC-07:00
05CE007,"THREEHILLS CREEK NEAR CARBON",51.564460,-113.073420,AB,UTC-07:00
05CE010,"RAY CREEK NEAR INNISFAIL",52.001100,-113.599800,AB,UTC-07:00
05CE011,"RENWICK CREEK NEAR THREE HILLS",51.716950,-113.363100,AB,UTC-07:00
05CE012,"GHOSTPINE CREEK NEAR HUXLEY",51.895910,-113.241070,AB,UTC-07:00
05CE018,"THREEHILLS CREEK BELOW RAY CREEK",51.997400,-113.568600,AB,UTC-07:00
05CE020,"MICHICHI CREEK AT DRUMHELLER",51.471640,-112.717200,AB,UTC-07:00
05CH007,"BERRY CREEK NEAR THE MOUTH",50.855090,-111.590610,AB,UTC-07:00
05CH008,"BERRY CREEK NEAR ROSE LYNN",51.415550,-111.494700,AB,UTC-07:00
05CH013,"FORSTER RESERVOIR NEAR CESSFORD",50.980830,-111.765560,AB,UTC-07:00
05CH014,"BERRY CREEK RESERVOIR NEAR SUNNYNOOK",51.262220,-111.639440,AB,UTC-07:00
05CJ006,"ONETREE CREEK NEAR PATRICIA",50.733330,-111.687500,AB,UTC-07:00
05CJ012,"MATZHIWIN CREEK BELOW WARE COULEE",50.820560,-111.827800,AB,UTC-07:00
05CK004,"RED DEER RIVER NEAR BINDLOSS",50.902780,-110.297200,AB,UTC-07:00
05CK005,"ALKALI CREEK NEAR THE MOUTH",50.898330,-110.508300,AB,UTC-07:00
05DA009,"NORTH SASKATCHEWAN RIVER AT WHIRLPOOL POINT",52.001670,-116.469400,AB,UTC-07:00
05DB002,"PRAIRIE CREEK NEAR ROCKY MOUNTAIN HOUSE",52.272222,-114.930556,AB,UTC-07:00
05DB006,"CLEARWATER RIVER NEAR DOVERCOURT",52.252500,-114.853900,AB,UTC-07:00
05DC001,"NORTH SASKATCHEWAN RIVER NEAR ROCKY MOUNTAIN HOUSE",52.380830,-114.939200,AB,UTC-07:00
05DC011,"NORTH RAM RIVER AT FORESTRY ROAD",52.281944,-115.991667,AB,UTC-07:00
05DD004,"BROWN CREEK AT FORESTRY ROAD",52.761110,-116.355600,AB,UTC-07:00
05DD007,"BRAZEAU RIVER BELOW CARDINAL RIVER",52.880550,-116.577800,AB,UTC-07:00
05DD009,"NORDEGG RIVER AT SUNCHILD ROAD",52.820280,-115.519400,AB,UTC-07:00
05DE002,"WABAMUN LAKE AT WABAMUN",53.555833,-114.469722,AB,UTC-07:00
05DE006,"NORTH SASKATCHEWAN RIVER NEAR LODGEPOLE",53.051670,-115.209200,AB,UTC-07:00
05DE007,"ROSE CREEK NEAR ALDER FLATS",52.930000,-115.010000,AB,UTC-07:00
05DE009,"TOMAHAWK CREEK NEAR TOMAHAWK",53.405833,-114.761388,AB,UTC-07:00
05DE010,"NORTH SASKATCHEWAN RIVER AT HIGHWAY NO. 759",53.315280,-114.805560,AB,UTC-07:00
05DF001,"NORTH SASKATCHEWAN RIVER AT EDMONTON",53.537500,-113.484400,AB,UTC-07:00
05DF003,"BLACKMUD CREEK NEAR ELLERSLIE",53.413889,-113.515556,AB,UTC-07:00
05DF004,"STRAWBERRY CREEK NEAR THE MOUTH",53.311390,-114.050600,AB,UTC-07:00
05DF006,"WHITEMUD CREEK NEAR ELLERSLIE",53.412222,-113.591667,AB,UTC-07:00
05DF008,"WEED CREEK AT THORSBY",53.234194,-114.050611,AB,UTC-07:00
05DF009,"WHITEMUD CREEK AT EDMONTON",53.483020,-113.554550,AB,UTC-07:00
05EA002,"STURGEON RIVER AT ST. ALBERT",53.635777,-113.627222,AB,UTC-07:00
05EA005,"STURGEON RIVER NEAR VILLENEUVE",53.655000,-113.761700,AB,UTC-07:00
05EA006,"LAC STE. ANNE AT ALBERTA BEACH",53.676388,-114.357500,AB,UTC-07:00
05EA011,"CARROT CREEK NEAR THE MOUTH",53.623555,-113.696305,AB,UTC-07:00
05EA012,"ATIM CREEK AT CENTURY ROAD",53.590277,-113.883611,AB,UTC-07:00
05EA013,"KILINI CREEK AT TWP ROAD NO 543",53.672130,-114.135500,AB,UTC-07:00
05EE005,"STRETTON CREEK NEAR MARWAYNE",53.441670,-110.325000,AB,UTC-07:00
05EE006,"VERMILION RIVER TRIBUTARY NEAR BRUCE",53.295000,-112.048300,AB,UTC-07:00
05EE009,"VERMILION RIVER AT VEGREVILLE",53.491110,-112.038300,AB,UTC-07:00
05EE010,"VERMILION RIVER AT RANGE ROAD NO. 105",53.619200,-111.450630,AB,UTC-07:00
05EE011,"VERMILION LAKES NEAR MORECAMBE",53.641900,-111.475600,AB,UTC-07:00
05EF001,"NORTH SASKATCHEWAN RIVER NEAR DEER CREEK",53.523170,-109.617900,SK,UTC-06:00
05FA001,"BATTLE RIVER NEAR PONOKA",52.662220,-113.582200,AB,UTC-07:00
05FA011,"BATTLE RIVER AT DUHAMEL",52.948611,-112.964444,AB,UTC-07:00
05FA013,"PIGEON LAKE AT PIGEON LAKE PROVINCIAL PARK",53.023766,-114.126483,AB,UTC-07:00
05FA025,"CAMROSE CREEK NEAR CAMROSE",53.041388,-112.829722,AB,UTC-07:00
05FC001,"BATTLE RIVER NEAR FORESTBURG",52.573890,-112.340300,AB,UTC-07:00
05FC008,"BATTLE RIVER AT HIGHWAY NO. 872",52.404720,-111.411400,AB,UTC-07:00
05FD007,"SHORNCLIFFE LAKE NEAR CZAR",52.472360,-110.863610,AB,UTC-07:00
05FE002,"BUFFALO CREEK AT HIGHWAY NO. 41",53.007220,-110.865800,AB,UTC-07:00
05FE004,"BATTLE RIVER NEAR THE SASKATCHEWAN BOUNDARY",52.856390,-110.018300,SK,UTC-06:00
05GA003,"MONITOR CREEK NEAR MONITOR",51.969440,-110.575000,AB,UTC-07:00
05GA008,"SOUNDING CREEK NEAR OYEN",51.565280,-110.473600,AB,UTC-07:00
05GA012,"SOUNDING CREEK NEAR CHINOOK",51.547780,-110.919700,AB,UTC-07:00
05GG001,"NORTH SASKATCHEWAN RIVER AT PRINCE ALBERT",53.202780,-105.768300,SK,UTC-06:00
05HA003,"BEAR CREEK NEAR PIAPOT",49.898610,-109.105600,SK,UTC-06:00
05HC005,"ANTELOPE CREEK NEAR CABRI",50.661390,-108.380600,SK,UTC-06:00
05HD036,"SWIFT CURRENT CREEK BELOW ROCK CREEK",49.844170,-108.479400,SK,UTC-06:00
05HD039,"SWIFT CURRENT CREEK NEAR LEINAN",50.493890,-107.658600,SK,UTC-06:00
05HD042,"ILLERBRUN CREEK NEAR SIMMIE",49.932000,-108.258000,SK,UTC-06:00
05HF003,"LAKE DIEFENBAKER AT GARDINER DAM",51.280280,-106.838300,SK,UTC-06:00
05HG001,"SOUTH SASKATCHEWAN RIVER AT SASKATOON",52.140280,-106.643300,SK,UTC-06:00
05HG002,"BRIGHTWATER CREEK NEAR KENASTON",51.562500,-106.500800,SK,UTC-06:00
05HG021,"INVERNESS CREEK NEAR BRODERICK",51.504440,-106.821700,SK,UTC-06:00
05JA002,"WOOD RIVER NEAR LAFLECHE",49.668610,-106.694170,SK,UTC-06:00
05JA003,"MCDONALD CREEK NEAR MCCORD",49.437780,-106.835830,SK,UTC-06:00
05JA005,"WOOD RIVER NEAR MCCORD",49.494780,-106.786780,SK,UTC-06:00
05JA006,"SIX MILE CREEK NEAR GLENTWORTH",49.496030,-106.754890,SK,UTC-06:00
05JB001,"NOTUKEU CREEK NEAR VANGUARD",49.917500,-107.185600,SK,UTC-06:00
05JB004,"NOTUKEU CREEK ABOVE ADMIRAL RESERVOIR",49.708890,-108.125300,SK,UTC-06:00
05JB007,"MOSQUITO CREEK NEAR PAMBRUN",49.976940,-107.436700,SK,UTC-06:00
05JC004,"RUSHLAKE CREEK ABOVE HIGHFIELD RESERVOIR",50.253330,-107.468300,SK,UTC-06:00
05JE006,"MOOSE JAW RIVER NEAR BURDICK",50.400000,-105.397200,SK,UTC-06:00
05JF001,"QU'APPELLE RIVER NEAR LUMSDEN",50.650470,-104.866780,SK,UTC-06:00
05JF005,"WASCANA CREEK NEAR LUMSDEN",50.636110,-104.909700,SK,UTC-06:00
05JF006,"BOGGY CREEK NEAR LUMSDEN",50.598610,-104.818100,SK,UTC-06:00
05JF008,"FAHLMAN CREEK NEAR DAVIN",50.369000,-104.192000,SK,UTC-06:00
05JF011,"COTTONWOOD CREEK NEAR LUMSDEN",50.590560,-104.908600,SK,UTC-06:00
05JG004,"QU'APPELLE RIVER ABOVE BUFFALO POUND",50.783000,-105.825000,SK,UTC-06:00
05JG006,"ELBOW DIVERSION CANAL AT DROP STRUCTURE",50.977780,-106.398600,SK,UTC-06:00
05JG013,"RIDGE CREEK NEAR BRIDGEFORD",50.951390,-106.329400,SK,UTC-06:00
05JH004,"LAST MOUNTAIN LAKE AT ROWANS RAVINE",50.997780,-105.185600,SK,UTC-06:00
05JJ003,"LANIGAN CREEK ABOVE BOULDER LAKE",51.649440,-105.237200,SK,UTC-06:00
05JJ009,"SALINE CREEK NEAR NOKOMIS",51.416110,-105.102800,SK,UTC-06:00
05JK002,"QUAPPELLE RIVER BELOW CRAVEN DAM",50.705550,-104.797200,SK,UTC-06:00
05JK004,"JUMPING DEER CREEK NEAR LIPTON",50.919450,-103.899200,SK,UTC-06:00
05JK007,"QU'APPELLE RIVER BELOW LOON CREEK",50.786390,-104.289200,SK,UTC-06:00
05JL005,"PHEASANT CREEK NEAR ABERNETHY",50.733330,-103.328100,SK,UTC-06:00
05JM001,"QUAPPELLE RIVER NEAR WELBY",50.491110,-101.557800,SK,UTC-06:00
05JM010,"EKAPO CREEK NEAR MARIEVAL",50.529722,-102.710277,SK,UTC-06:00
05JM015,"CUTARM CREEK NEAR SPY HILL",50.590830,-101.742800,SK,UTC-06:00
05KD003,"SASKATCHEWAN RIVER BELOW TOBIN LAKE",53.702780,-103.297200,SK,UTC-06:00
05KD004,"TOBIN LAKE AT THE SPILLWAY",53.652780,-103.398100,SK,UTC-06:00
05KD007,"SASKATCHEWAN RIVER BELOW THE FORKS",53.246110,-105.068330,SK,UTC-06:00
05KE010,"WHITE GULL CREEK AT HIGHWAY NO. 106",53.862780,-104.617200,SK,UTC-06:00
05KH007,"CARROT RIVER NEAR TURNBERRY",53.613330,-102.103900,SK,UTC-06:00
05KH015,"CARROT RIVER NEAR THE PAS",53.806000,-101.374860,MB,UTC-06:00
05KJ001,"SASKATCHEWAN RIVER AT THE PAS",53.841670,-101.186100,MB,UTC-06:00
05KK002,"CORMORANT LAKE AT CORMORANT",54.216670,-100.600000,MB,UTC-06:00
05KK005,"NORTH MOOSE LAKE AT MOOSE LAKE NARROWS CONTROL STRUCTURE",53.939450,-100.146100,MB,UTC-06:00
05KK006,"SOUTH MOOSE LAKE AT MOOSE LAKE NARROWS CONTROL STRUCTURE",53.939450,-100.146100,MB,UTC-06:00
05KL005,"CEDAR LAKE NEAR OLESON POINT",53.319170,-100.278900,MB,UTC-06:00
05LC001,"RED DEER RIVER NEAR ERWOOD",52.860000,-102.194200,SK,UTC-06:00
05LC004,"RED DEER RIVER NEAR THE MOUTH",52.876280,-101.049390,MB,UTC-06:00
05LD001,"OVERFLOWING RIVER AT OVERFLOWING RIVER",53.142500,-101.101900,MB,UTC-06:00
05LD002,"LAKE WINNIPEGOSIS AT DAWSON BAY",52.974530,-100.978970,MB,UTC-06:00
05LE001,"SWAN RIVER AT SWAN RIVER",52.095830,-101.258330,MB,UTC-06:00
05LE004,"WOODY RIVER NEAR BOWSMAN",52.258340,-101.137500,MB,UTC-06:00
05LE005,"ROARING RIVER NEAR MINITONAS",52.152780,-101.052800,MB,UTC-06:00
05LE006,"SWAN RIVER NEAR MINITONAS",52.196390,-101.060300,MB,UTC-06:00
05LE010,"BIRCH RIVER NEAR BIRCH RIVER",52.373610,-101.083300,MB,UTC-06:00
05LG003,"GARLAND RIVER NEAR GARLAND",51.667390,-100.489610,MB,UTC-06:00
05LG004,"NORTH DUCK RIVER AT COWAN",52.030560,-100.650000,MB,UTC-06:00
05LH001,"LAKE WINNIPEGOSIS AT WINNIPEGOSIS",51.645830,-99.918610,MB,UTC-06:00
05LH005,"WATERHEN RIVER NEAR WATERHEN",51.852780,-99.547230,MB,UTC-06:00
05LJ005,"OCHRE RIVER AT OCHRE RIVER",51.051110,-99.787500,MB,UTC-06:00
05LJ007,"TURTLE RIVER NEAR LAURIER",50.944440,-99.520840,MB,UTC-06:00
05LJ009,"DAUPHIN LAKE AT OUTLET",51.439450,-99.950000,MB,UTC-06:00
05LJ010,"VALLEY RIVER NEAR DAUPHIN",51.279170,-100.010800,MB,UTC-06:00
05LJ012,"VERMILION RIVER NEAR DAUPHIN",51.183330,-100.012500,MB,UTC-06:00
05LJ019,"MINK CREEK NEAR ETHELBERT",51.416670,-100.352800,MB,UTC-06:00
05LJ025,"MOSSY RIVER BELOW OUTLET OF DAUPHIN LAKE",51.450000,-99.966670,MB,UTC-06:00
05LJ027,"MCKINNON CREEK NEAR MCCREARY",50.800000,-99.479450,MB,UTC-06:00
05LJ045,"WILSON RIVER NEAR ASHVILLE",51.158330,-100.333300,MB,UTC-06:00
05LK002,"LAKE MANITOBA AT STEEP ROCK",51.440560,-98.803610,MB,UTC-06:00
05LL002,"WHITEMUD RIVER AT WESTBOURNE",50.134170,-98.583340,MB,UTC-06:00
05LL005,"WHITEMUD RIVER NEAR KEYES",50.187500,-99.102780,MB,UTC-06:00
05LL012,"LAKE MANITOBA NEAR WESTBOURNE",50.254170,-98.580560,MB,UTC-06:00
05LL014,"PINE CREEK NEAR MELBOURNE",49.900000,-99.208340,MB,UTC-06:00
05LL015,"BIG GRASS RIVER NEAR GLENELLA",50.506110,-98.970830,MB,UTC-06:00
05LL019,"PORTAGE DIVERSION NEAR PORTAGE LA PRAIRIE",49.965560,-98.380280,MB,UTC-06:00
05LL021,"RAT CREEK NEAR MACDONALD",49.988610,-98.464170,MB,UTC-06:00
05LL027,"PELICAN CREEK SOUTH TRIBUTARY NEAR BIRNIE",50.476670,-99.475830,MB,UTC-06:00
05LM001,"FAIRFORD RIVER NEAR FAIRFORD",51.600000,-98.704170,MB,UTC-06:00
05LM005,"LAKE ST. MARTIN NEAR HILBRE",51.559170,-98.527220,MB,UTC-06:00
05LM006,"DAUPHIN RIVER NEAR DAUPHIN RIVER",52.000000,-98.322220,MB,UTC-06:00
05LN006,"BURNT LAKE DRAIN NORTHWEST OF LUNDAR",50.720780,-98.075670,MB,UTC-06:00
05MA002,"LITTLE QUILL LAKE NEAR WYNARD",51.879640,-104.137830,SK,UTC-06:00
05MA010,"BIG QUILL LAKE NEAR KANDAHAR",51.781670,-104.319440,SK,UTC-06:00
05MA011,"BIRCH CREEK NEAR ELFROS",51.746110,-103.874200,SK,UTC-06:00
05MA012,"IRONSPRING CREEK NEAR WATSON",52.056950,-104.498900,SK,UTC-06:00
05MA016,"ROMANCE CREEK NEAR WATSON",51.993610,-104.553100,SK,UTC-06:00
05MA020,"QUILL CREEK NEAR QUILL LAKE",52.003060,-104.247200,SK,UTC-06:00
05MA021,"MAGNUSSON CREEK NEAR WYNYARD",51.814450,-104.203100,SK,UTC-06:00
05MA025,"RANCH CREEK ABOVE RANCH LAKE",52.405530,-104.789250,SK,UTC-06:00
05MB001,"YORKTON CREEK NEAR EBENEZER",51.380550,-102.503100,SK,UTC-06:00
05MB003,"WHITESAND RIVER NEAR CANORA",51.636390,-102.369700,SK,UTC-06:00
05MC001,"ASSINIBOINE RIVER AT STURGIS",51.939720,-102.546900,SK,UTC-06:00
05MC003,"LILIAN RIVER NEAR LADY LAKE",52.022780,-102.625000,SK,UTC-06:00
05MD004,"ASSINIBOINE RIVER AT KAMSACK",51.564720,-101.916100,SK,UTC-06:00
05MD005,"SHELL RIVER NEAR INGLIS",50.961110,-101.318100,MB,UTC-06:00
05MD007,"SHELL RIVER NEAR ROBLIN",51.360830,-101.255800,MB,UTC-06:00
05MD009,"LAKE OF THE PRAIRIES NEAR SHELLMOUTH",50.966110,-101.422500,MB,UTC-06:00
05MD010,"STONY CREEK NEAR KAMSACK",51.388610,-101.838600,SK,UTC-06:00
05MD011,"LAKE OF THE PRAIRIES NEAR ROBLIN",51.226530,-101.530750,MB,UTC-06:00
05ME003,"BIRDTAIL CREEK NEAR BIRTLE",50.530560,-100.950000,MB,UTC-06:00
05ME005,"CONJURING CREEK NEAR RUSSELL",50.791670,-101.298600,MB,UTC-06:00
05ME006,"ASSINIBOINE RIVER NEAR MINIOTA",50.110830,-101.035600,MB,UTC-06:00
05ME007,"SMITH CREEK NEAR MARCHWELL",50.832780,-101.578600,SK,UTC-06:00
05ME009,"SCISSOR CREEK NEAR MCAULEY",50.271110,-101.384400,MB,UTC-06:00
05ME010,"SILVER CREEK NEAR BINSCARTH",50.623050,-101.256100,MB,UTC-06:00
05ME011,"ASSINIBOINE RIVER SOUTHWEST OF ST. LAZARE",50.442220,-101.318610,MB,UTC-06:00
05ME012,"ASSINIBOINE RIVER WEST OF RUSSELL",50.766360,-101.437250,MB,UTC-06:00
05MF001,"LITTLE SASKATCHEWAN RIVER NEAR MINNEDOSA",50.357780,-99.900000,MB,UTC-06:00
05MF008,"ROLLING RIVER NEAR ERICKSON",50.520000,-99.940830,MB,UTC-06:00
05MF018,"LITTLE SASKATCHEWAN RIVER NEAR RIVERS",50.023610,-100.207750,MB,UTC-06:00
05MF020,"LAKE WAHTOPANAH NEAR RIVERS",50.026940,-100.199400,MB,UTC-06:00
05MF024,"LITTLE SASKATCHEWAN RIVER NEAR HOROD",50.690000,-100.248100,MB,UTC-06:00
05MG001,"ARROW RIVER NEAR ARROW RIVER",50.086110,-100.958300,MB,UTC-06:00
05MG003,"GOPHER CREEK NEAR VIRDEN",49.783330,-100.964400,MB,UTC-06:00
05MG004,"OAK RIVER NEAR RIVERS",50.025000,-100.393100,MB,UTC-06:00
05MG013,"ASSINIBOINE RIVER NORTH OF GRISWOLD",49.843060,-100.462780,MB,UTC-06:00
05MG014,"ASSINIBOINE RIVER EAST OF VIRDEN",49.875280,-100.848890,MB,UTC-06:00
05MG015,"BAILEYS CREEK NEAR OAK LAKE",49.871390,-100.672220,MB,UTC-06:00
05MH001,"ASSINIBOINE RIVER AT BRANDON",49.861440,-99.961580,MB,UTC-06:00
05MH005,"ASSINIBOINE RIVER NEAR HOLLAND",49.698330,-98.898890,MB,UTC-06:00
05MH006,"LITTLE SOURIS RIVER NEAR BRANDON",49.732220,-99.847780,MB,UTC-06:00
05MH007,"EPINETTE CREEK NEAR CARBERRY",49.741110,-99.330560,MB,UTC-06:00
05MH008,"CYPRESS RIVER NEAR BRUXELLES",49.446110,-98.906940,MB,UTC-06:00
05MJ001,"ASSINIBOINE RIVER AT HEADINGLEY",49.869170,-97.402780,MB,UTC-06:00
05MJ003,"ASSINIBOINE RIVER NEAR PORTAGE LA PRAIRIE",49.935830,-98.280000,MB,UTC-06:00
05MJ004,"STURGEON CREEK AT ST. JAMES",49.881110,-97.278610,MB,UTC-06:00
05MJ006,"PORTAGE RESERVOIR NEAR PORTAGE LA PRAIRIE",49.945280,-98.336670,MB,UTC-06:00
05MJ012,"ASSINIBOINE RIVER AT BAIE ST. PAUL",50.012500,-97.763050,MB,UTC-06:00
05MJ013,"OMANDS CREEK NEAR EMPRESS STREET EAST",49.884250,-97.194670,MB,UTC-06:00
05NA003,"LONG CREEK AT WESTERN CROSSING OF INTERNATIONAL BOUNDARY",49.000280,-103.352200,SK,UTC-06:00
05NA005,"GIBSON CREEK NEAR RADVILLE",49.483890,-104.336400,SK,UTC-06:00
05NA006,"LARSEN RESERVOIR NEAR RADVILLE",49.475000,-104.280560,SK,UTC-06:00
05NB001,"LONG CREEK NEAR ESTEVAN",49.104170,-103.013300,SK,UTC-06:00
05NB011,"YELLOW GRASS DITCH NEAR YELLOW GRASS",49.786390,-104.037800,SK,UTC-06:00
05NB014,"JEWEL CREEK NEAR GOODWATER",49.386110,-103.711700,SK,UTC-06:00
05NB016,"ROUGHBARK RESERVOIR NEAR WEYBURN",49.501390,-103.719720,SK,UTC-06:00
05NB018,"TATAGWA LAKE DRAIN NEAR WEYBURN",49.599450,-103.947200,SK,UTC-06:00
05NB020,"NICKLE LAKE NEAR Weyburn",49.575560,-103.768900,SK,UTC-06:00
05NB021,"SHORT CREEK NEAR ROCHE PERCEE",49.031110,-102.849200,SK,UTC-06:00
