 ID,Name / Nom,Latitude,Longitude,Prov/Terr,Timezone / Fuseau horaire
02GH003,"CANARD RIVER NEAR LUKERVILLE",42.158890,-83.018890,ON,UTC-05:00
02GH004,"TURKEY CREEK AT WINDSOR",42.260560,-83.039720,ON,UTC-05:00
02GH011,"LITTLE RIVER AT WINDSOR",42.309720,-82.928340,ON,UTC-05:00
02HA006,"TWENTY MILE CREEK AT BALLS FALLS",43.133610,-79.383330,ON,UTC-05:00
02HA007,"WELLAND RIVER BELOW CAISTOR CORNERS",43.021670,-79.617770,ON,UTC-05:00
02HA013,"NIAGARA RIVER AT FORT ERIE",42.930280,-78.914170,ON,UTC-05:00
02HA014,"REDHILL CREEK AT HAMILTON",43.232220,-79.784720,ON,UTC-05:00
02HA020,"TWENTY MILE CREEK ABOVE SMITHVILLE",43.115550,-79.566110,ON,UTC-05:00
02HA024,"OSWEGO CREEK AT CANBORO",42.991390,-79.678340,ON,UTC-05:00
02HA030,"FOUR MILE CREEK NEAR VIRGIL",43.195610,-79.113330,ON,UTC-05:00
02HA031,"TWELVE MILE CREEK NEAR POWER GLEN",43.114780,-79.274560,ON,UTC-05:00
02HA032,"NORTH CREEK NEAR SMITHVILLE",43.074530,-79.525000,ON,UTC-05:00
02HB001,"CREDIT RIVER NEAR CATARACT",43.835830,-80.022780,ON,UTC-05:00
02HB004,"EAST SIXTEEN MILE CREEK NEAR OMAGH",43.498890,-79.776950,ON,UTC-05:00
02HB005,"SIXTEEN MILE CREEK AT MILTON",43.513890,-79.879720,ON,UTC-05:00
02HB007,"SPENCER CREEK AT DUNDAS",43.265560,-79.964160,ON,UTC-05:00
02HB008,"CREDIT RIVER WEST BRANCH AT NORVAL",43.646670,-79.866390,ON,UTC-05:00
02HB011,"BRONTE CREEK NEAR ZIMMERMAN",43.436940,-79.864440,ON,UTC-05:00
02HB012,"GRINDSTONE CREEK NEAR ALDERSHOT",43.300560,-79.868890,ON,UTC-05:00
02HB013,"CREDIT RIVER NEAR ORANGEVILLE",43.891110,-80.062230,ON,UTC-05:00
02HB015,"SPENCER CREEK NEAR WESTOVER",43.353080,-80.077890,ON,UTC-05:00
02HB018,"CREDIT RIVER AT BOSTON MILLS",43.773610,-79.926940,ON,UTC-05:00
02HB020,"CREDIT RIVER ERIN BRANCH ABOVE ERIN",43.771950,-80.093330,ON,UTC-05:00
02HB021,"ANCASTER CREEK AT ANCASTER",43.231170,-79.973860,ON,UTC-05:00
02HB022,"BRONTE CREEK AT CARLISLE",43.388890,-79.988050,ON,UTC-05:00
02HB023,"SPENCER CREEK AT HIGHWAY NO. 5",43.283050,-80.052780,ON,UTC-05:00
02HB024,"BLACK CREEK BELOW ACTON",43.629310,-80.010420,ON,UTC-05:00
02HB025,"CREDIT RIVER AT NORVAL",43.647500,-79.856110,ON,UTC-05:00
02HB027,"FOURTEEN MILE CREEK AT OAKVILLE",43.421110,-79.703060,ON,UTC-05:00
02HB028,"GRINDSTONE CREEK NEAR MILLGROVE",43.334860,-79.949060,ON,UTC-05:00
02HB029,"CREDIT RIVER AT STREETSVILLE",43.582360,-79.708110,ON,UTC-05:00
02HB030,"COOKSVILLE CREEK NEAR COOKSVILLE",43.592330,-79.623890,ON,UTC-05:00
02HB031,"CREDIT RIVER ERIN BRANCH AT HILLSBURGH",43.790250,-80.143440,ON,UTC-05:00
02HB032,"MOUNTSBERG CREEK BELOW MOUNTSBERG RESERVOIR",43.454830,-80.045830,ON,UTC-05:00
02HB033,"MOUNTSBERG CREEK NEAR CARLISLE",43.401530,-79.993030,ON,UTC-05:00
02HC003,"HUMBER RIVER AT WESTON",43.698890,-79.520280,ON,UTC-05:00
02HC005,"DON RIVER AT YORK MILLS",43.740280,-79.403050,ON,UTC-05:00
02HC009,"EAST HUMBER RIVER NEAR PINE GROVE",43.790000,-79.584440,ON,UTC-05:00
02HC013,"HIGHLAND CREEK NEAR WEST HILL",43.778330,-79.191390,ON,UTC-05:00
02HC017,"ETOBICOKE CREEK AT BRAMPTON",43.691390,-79.759720,ON,UTC-05:00
02HC018,"LYNDE CREEK NEAR WHITBY",43.875560,-78.960280,ON,UTC-05:00
02HC019,"DUFFINS CREEK ABOVE PICKERING",43.891390,-79.059170,ON,UTC-05:00
02HC022,"ROUGE RIVER NEAR MARKHAM",43.858330,-79.233610,ON,UTC-05:00
02HC023,"COLD CREEK NEAR BOLTON (02HC023)",43.890278,-79.720000,ON,UTC-05:00
02HC024,"DON RIVER AT TODMORDEN",43.685830,-79.361390,ON,UTC-05:00
02HC025,"HUMBER RIVER AT ELDER MILLS",43.811390,-79.627780,ON,UTC-05:00
02HC027,"BLACK CREEK NEAR WESTON",43.674170,-79.504450,ON,UTC-05:00
02HC028,"LITTLE ROUGE CREEK NEAR LOCUST HILL",43.907770,-79.216110,ON,UTC-05:00
02HC030,"ETOBICOKE CREEK BELOW QUEEN ELIZABETH HIGHWAY",43.601670,-79.556390,ON,UTC-05:00
02HC031,"WEST HUMBER RIVER AT HIGHWAY NO. 7",43.758340,-79.678890,ON,UTC-05:00
02HC032,"EAST HUMBER RIVER AT KING CREEK",43.902780,-79.612780,ON,UTC-05:00
02HC033,"MIMICO CREEK AT ISLINGTON",43.647500,-79.519720,ON,UTC-05:00
02HC038,"WEST DUFFINS CREEK ABOVE GREEN RIVER",43.915000,-79.179720,ON,UTC-05:00
02HC047,"HUMBER RIVER NEAR PALGRAVE",43.930830,-79.822220,ON,UTC-05:00
02HC049,"DUFFINS CREEK AT AJAX",43.848890,-79.056110,ON,UTC-05:00
02HC051,"CENTREVILLE CREEK NEAR ALBION",43.924450,-79.834440,ON,UTC-05:00
02HC053,"LITTLE ROUGE RIVER NEAR DICKSONS HILL",43.925690,-79.282190,ON,UTC-05:00
02HC054,"LYNDE CREEK AT BROOKLIN",43.959170,-78.960000,ON,UTC-05:00
02HC055,"LYNDE CREEK TRIBUTARY NEAR KINSALE",43.931950,-78.988610,ON,UTC-05:00
02HC056,"DON RIVER EAST BRANCH NEAR THORNHILL",43.826610,-79.438080,ON,UTC-05:00
02HC057,"HUMBER RIVER NEAR BALLYCROY",43.970310,-79.887720,ON,UTC-05:00
02HC058,"WEST HIGHLAND CREEK NEAR SCARBOROUGH VILLAGE",43.753220,-79.233670,ON,UTC-05:00
02HC059,"Humber River at Highway No. 9",43.968770,-79.873740,ON,UTC-05:00
02HD003,"GANARASKA RIVER NEAR OSACA",44.015280,-78.437500,ON,UTC-05:00
02HD004,"NORTH WEST GANARASKA RIVER NEAR OSACA",44.017220,-78.438890,ON,UTC-05:00
02HD006,"BOWMANVILLE CREEK AT BOWMANVILLE",43.921470,-78.702000,ON,UTC-05:00
02HD008,"OSHAWA CREEK AT OSHAWA",43.930280,-78.891670,ON,UTC-05:00
02HD009,"WILMOT CREEK NEAR NEWCASTLE",43.930280,-78.618890,ON,UTC-05:00
02HD010,"SHELTER VALLEY BROOK NEAR GRAFTON",43.991940,-78.001390,ON,UTC-05:00
02HD012,"GANARASKA RIVER ABOVE DALE",43.990830,-78.328330,ON,UTC-05:00
02HD013,"HARMONY CREEK AT OSHAWA",43.888890,-78.825000,ON,UTC-05:00
02HD018,"PROCTORS CREEK NEAR BRIGHTON",44.059720,-77.744450,ON,UTC-05:00
02HD019,"COBOURG BROOK AT COBOURG",43.965000,-78.185000,ON,UTC-05:00
02HD020,"BALTIMORE CREEK AT BALTIMORE",44.028830,-78.147060,ON,UTC-05:00
02HD021,"WILMOT CREEK NEAR LESKARD",44.005720,-78.642330,ON,UTC-05:00
02HD022,"COBOURG BROOK NEAR PRECIOUS CORNERS",43.988470,-78.210750,ON,UTC-05:00
02HD023,"MACKIE CREEK NEAR HAMPTON",43.979080,-78.680310,ON,UTC-05:00
02HD024,"GAGE CREEK NEAR DALE",43.997030,-78.254330,ON,UTC-05:00
02HE002,"CONSECON CREEK AT ALISONVILLE",44.027780,-77.366670,ON,UTC-05:00
02HE004,"BLACK CREEK AT MILFORD",43.936830,-77.094970,ON,UTC-05:00
02HF002,"GULL RIVER AT NORLAND",44.731950,-78.818050,ON,UTC-05:00
02HF003,"BURNT RIVER NEAR BURNT RIVER",44.710000,-78.677500,ON,UTC-05:00
02HG001,"MARIPOSA BROOK NEAR LITTLE BRITAIN",44.289720,-78.841670,ON,UTC-05:00
02HG002,"NONQUON RIVER NEAR PORT PERRY",44.086690,-79.006080,ON,UTC-05:00
02HG003,"BLACKSTOCK CREEK NEAR BLACKSTOCK",44.131920,-78.828970,ON,UTC-05:00
02HH003,"PIGEON RIVER NEAR LOTUS",44.124170,-78.695000,ON,UTC-05:00
02HH005,"PIGEON RIVER AT OMEMEE",44.296720,-78.550000,ON,UTC-05:00
02HJ001,"JACKSON CREEK AT PETERBOROUGH",44.302500,-78.321110,ON,UTC-05:00
02HJ003,"OUSE RIVER NEAR WESTWOOD",44.298610,-78.045560,ON,UTC-05:00
02HJ005,"SQUIRREL CREEK NEAR BAILIEBORO",44.123330,-78.388610,ON,UTC-05:00
02HJ006,"JACKSON CREEK NEAR JACKSON HEIGHTS",44.309830,-78.370720,ON,UTC-05:00
02HJ007,"BAXTER CREEK AT MILLBROOK",44.150530,-78.447110,ON,UTC-05:00
02HJ008,"INDIAN RIVER AT GILCHRIST BAY",44.540470,-78.095360,ON,UTC-05:00
02HK003,"CROWE RIVER AT MARMORA",44.481670,-77.684720,ON,UTC-05:00
02HK005,"CROWE RIVER NEAR GLEN ALDA",44.844440,-77.931110,ON,UTC-05:00
02HK006,"BEAVER CREEK NEAR MARMORA",44.535280,-77.696660,ON,UTC-05:00
02HK007,"COLD CREEK AT ORLAND",44.134720,-77.786940,ON,UTC-05:00
02HK008,"RAWDON CREEK NEAR WEST HUNTINGDON",44.338050,-77.477220,ON,UTC-05:00
02HK009,"BURNLEY CREEK ABOVE WARKWORTH",44.195840,-77.911670,ON,UTC-05:00
02HK010,"TRENT RIVER AT TRENTON (AFFRA)",44.108330,-77.579170,ON,UTC-05:00
02HK011,"MAYHEW CREEK NEAR TRENTON",44.109170,-77.612530,ON,UTC-05:00
02HK015,"SALT CREEK NEAR CODRINGTON",44.204560,-77.819080,ON,UTC-05:00
02HK016,"TROUT CREEK NEAR CAMPBELLFORD",44.307000,-77.830940,ON,UTC-05:00
02HK017,"HOARDS CREEK NEAR WELLMAN",44.336940,-77.628670,ON,UTC-05:00
02HL001,"MOIRA RIVER NEAR FOXBORO",44.253610,-77.419170,ON,UTC-05:00
02HL003,"BLACK RIVER NEAR ACTINOLITE",44.539440,-77.370830,ON,UTC-05:00
02HL004,"SKOOTAMATTA RIVER NEAR ACTINOLITE",44.549720,-77.328060,ON,UTC-05:00
02HL005,"MOIRA RIVER NEAR DELORO",44.499720,-77.618330,ON,UTC-05:00
02HL007,"MOIRA RIVER NEAR TWEED",44.488610,-77.319440,ON,UTC-05:00
02HL008,"CLARE RIVER NEAR BOGART",44.483330,-77.227790,ON,UTC-05:00
02HM002,"DEPOT CREEK AT BELLROCK",44.471390,-76.762780,ON,UTC-05:00
02HM003,"SALMON RIVER NEAR SHANNONVILLE",44.207220,-77.209170,ON,UTC-05:00
02HM004,"WILTON CREEK NEAR NAPANEE",44.239440,-76.849440,ON,UTC-05:00
02HM005,"COLLINS CREEK NEAR KINGSTON",44.256390,-76.612500,ON,UTC-05:00
02HM006,"MILLHAVEN CREEK NEAR MILLHAVEN",44.226390,-76.759160,ON,UTC-05:00
02HM007,"NAPANEE RIVER AT CAMDEN EAST",44.334720,-76.838890,ON,UTC-05:00
02HM009,"WEST BRANCH LITTLE CATARAQUI CREEK NEAR KINGSTON",44.240000,-76.578890,ON,UTC-05:00
02HM010,"SALMON RIVER AT TAMWORTH",44.486110,-76.993060,ON,UTC-05:00
02HM011,"MILLHAVEN CREEK NEAR SYDENHAM",44.418890,-76.595000,ON,UTC-05:00
02JC008,"BLANCHE RIVER ABOVE ENGLEHART",47.889170,-79.879450,ON,UTC-05:00
02JD013,"BAY LAKE AT LATCHFORD",47.321110,-79.811940,ON,UTC-05:00
02JE011,"LAKE TIMISKAMING AT HAILEYBURY",47.450000,-79.629720,ON,UTC-05:00
02JE013,"OTTAWA RIVER AT MATTAWA",46.320560,-78.710830,ON,UTC-05:00
02JE024,"OTTAWA RIVER BELOW TEMISCAMING",46.707780,-79.101390,ON,UTC-05:00
02JE025,"TEMISCAMINGUE (LAC) À TEMISCAMING",46.718330,-79.105000,QC,UTC-05:00
02JE026,"TEMISCAMINGUE (LAC) À VILLE-MARIE",47.329440,-79.444730,QC,UTC-05:00
02JE027,"AMABLE DU FOND RIVER AT KIOSK",46.091830,-78.886000,ON,UTC-05:00
02JE028,"NET CREEK BELOW NET LAKE",47.082500,-79.731400,ON,UTC-05:00
02KA015,"AUMONDE CREEK NEAR MATTAWA",46.276250,-78.478330,ON,UTC-05:00
02KB001,"PETAWAWA RIVER NEAR PETAWAWA",45.886110,-77.315280,ON,UTC-05:00
02KC009,"BONNECHERE RIVER NEAR CASTLEFORD",45.496390,-76.564720,ON,UTC-05:00
02KC015,"MUSKRAT RIVER NEAR PEMBROKE",45.797750,-77.108330,ON,UTC-05:00
02KC018,"INDIAN RIVER AT PEMBROKE",45.818060,-77.124030,ON,UTC-05:00
02KD002,"YORK RIVER NEAR BANCROFT",45.052360,-77.844670,ON,UTC-05:00
02KD004,"MADAWASKA RIVER AT PALMER RAPIDS",45.328060,-77.515560,ON,UTC-05:00
02KF001,"MISSISSIPPI RIVER AT FERGUSONS FALLS",45.053050,-76.285550,ON,UTC-05:00
02KF005,"OTTAWA RIVER AT BRITANNIA",45.365000,-75.805000,ON,UTC-05:00
02KF006,"MISSISSIPPI RIVER AT APPLETON",45.176390,-76.123610,ON,UTC-05:00
02KF010,"CLYDE RIVER NEAR LANARK",45.045830,-76.400830,ON,UTC-05:00
02KF011,"CARP RIVER NEAR KINBURN",45.417500,-76.198610,ON,UTC-05:00
02KF012,"INDIAN RIVER NEAR BLAKENEY",45.245560,-76.260280,ON,UTC-05:00
02KF013,"CLYDE RIVER AT GORDON RAPIDS",45.133890,-76.630000,ON,UTC-05:00
02KF015,"GRAHAM CREEK AT NEPEAN",45.343580,-75.808080,ON,UTC-05:00
02KF016,"MISSISSIPPI RIVER BELOW MARBLE LAKE",44.843060,-77.120000,ON,UTC-05:00
02KF017,"BUCKSHOT CREEK NEAR PLEVNA",44.968330,-76.966390,ON,UTC-05:00
02KF018,"FALL RIVER AT OUTLET OF BENNETT LAKE",44.947780,-76.410840,ON,UTC-05:00
02KF019,"MISSISSIPPI RIVER AT OUTLET OF DALHOUSIE LAKE",44.972580,-76.539170,ON,UTC-05:00
02KF020,"SHARBOT LAKE AT OUTLET OF SHARBOT LAKE",44.774720,-76.640270,ON,UTC-05:00
02LA004,"RIDEAU RIVER AT OTTAWA",45.381670,-75.697780,ON,UTC-05:00
02LA006,"KEMPTVILLE CREEK NEAR KEMPTVILLE",44.993890,-75.662780,ON,UTC-05:00
02LA007,"JOCK RIVER NEAR RICHMOND",45.249440,-75.790560,ON,UTC-05:00
02LA015,"OUTAOUAIS (RIVIERE DES) À HULL",45.431420,-75.706170,ON,UTC-05:00
02LA024,"TAY RIVER IN PERTH",44.896950,-76.252500,ON,UTC-05:00
02LA026,"STEVEN CREEK NEAR NORTH GOWER",45.137940,-75.705080,ON,UTC-05:00
02LA027,"RIDEAU RIVER ABOVE RIDEAU FALLS",45.439920,-75.692940,ON,UTC-05:00
02LB005,"SOUTH NATION RIVER NEAR PLANTAGENET SPRINGS",45.517500,-74.978890,ON,UTC-05:00
02LB006,"CASTOR RIVER AT RUSSELL",45.261940,-75.344440,ON,UTC-05:00
02LB007,"SOUTH NATION RIVER AT SPENCERVILLE",44.842220,-75.543890,ON,UTC-05:00
02LB008,"BEAR BROOK NEAR BOURGET",45.426390,-75.153340,ON,UTC-05:00
02LB009,"SOUTH NATION RIVER AT CHESTERVILLE",45.100800,-75.226670,ON,UTC-05:00
02LB013,"SOUTH NATION RIVER AT CASSELMAN",45.316940,-75.092200,ON,UTC-05:00
02LB017,"NORTH BRANCH SOUTH NATION RIV. NR HECKSTON",44.994940,-75.516330,ON,UTC-05:00
02LB018,"WEST BRANCH SCOTCH RIVER NEAR ST. ISIDORE DE PRESCOTT",45.375330,-74.948000,ON,UTC-05:00
02LB020,"SOUTH CASTOR RIVER AT KENMORE",45.227780,-75.412780,ON,UTC-05:00
02LB022,"PAYNE RIVER NEAR BERWICK",45.191670,-75.105560,ON,UTC-05:00
02LB031,"SOUTH BRANCH SOUTH NATION RIVER NEAR WINCHESTER SPRINGS",45.014170,-75.355170,ON,UTC-05:00
02LB032,"RIGAUD RIVER NEAR ST. EUGENE",45.491420,-74.441805,ON,UTC-05:00
02LB033,"BECKETTS CREEK NEAR BECKETTS CREEK",45.520750,-75.358330,ON,UTC-05:00
02MB006,"LYN CREEK NEAR LYN",44.525000,-75.805280,ON,UTC-05:00
02MB010,"BUELLS CREEK AT BROCKVILLE",44.585830,-75.691670,ON,UTC-05:00
02MC001,"RAISIN RIVER NEAR WILLIAMSTOWN",45.155280,-74.638340,ON,UTC-05:00
02MC005,"SAINT-LAURENT À POINTE DES CASCADES (MPO)",45.334444,-73.962111,QC,UTC-05:00
02MC026,"RIVIERE BEAUDETTE NEAR GLEN NEVIS",45.274170,-74.493610,ON,UTC-05:00
02MC027,"RAISIN RIVER AT BLACK RIVER",45.080610,-74.868000,ON,UTC-05:00
02MC028,"RIVIERE DELISLE NR ALEXANDRIA",45.316670,-74.644170,ON,UTC-05:00
02MC030,"SOUTH RAISIN RIVER NEAR CORNWALL",45.051390,-74.773610,ON,UTC-05:00
02MC036,"RIVIERE DELISLE NEAR GLEN NORMAN",45.317500,-74.601390,ON,UTC-05:00
02MC037,"GARRY RIVER NEAR ALEXANDRIA",45.290000,-74.650000,ON,UTC-05:00
02OA003,"MILLE-ÎLES À BOIS-DES-FILION",45.662953,-73.752165,QC,UTC-05:00
02OA013,"OUTAOUAIS À STE-ANNE-BELLEVUE (MPO)",45.404657,-73.956646,QC,UTC-05:00
02OA016,"SAINT-LAURENT À LASALLE",45.415012,-73.623166,QC,UTC-05:00
02OA033,"OUTAOUAIS À MARINE STE-ANNE",45.402500,-73.948890,QC,UTC-05:00
02OA039,"SAINT-LOUIS À POINTE-CLAIRE (MPO)",45.427687,-73.820680,QC,UTC-05:00
02OA041,"SAINT-LAURENT (FLEUVE) A LA PRAIRIE",45.464440,-73.520000,QC,UTC-05:00
02OA107,"OUTAOUAIS (RIVIERE DES) A TERRASSE-VAUDREUIL",45.388889,-73.998065,QC,UTC-05:00
02OB011,"SAINT-LAURENT À LANORAIE",45.959419,-73.214598,QC,UTC-05:00
02OE012,"MEMPHRÉMAGOG À MAGOG",45.267550,-72.161508,QC,UTC-05:00
02OH001,"CHAMPLAIN À PHILIPSBURG",45.039806,-73.079654,QC,UTC-05:00
02OJ007,"RICHELIEU AUX RAPIDES FRYERS",45.398470,-73.258449,QC,UTC-05:00
02OJ016,"RICHELIEU À ST-JEAN",45.302319,-73.250012,QC,UTC-05:00
02XA003,"LITTLE MECATINA RIVER ABOVE LAC FOURMONT",52.228330,-61.322500,NL,UTC-04:00
02YA002,"BARTLETTS RIVER NEAR ST. ANTHONY",51.449170,-55.641940,NL,UTC-03:30
02YC001,"TORRENT RIVER AT BRISTOL'S POOL",50.607500,-57.151110,NL,UTC-03:30
02YD002,"NORTHEAST BROOK NEAR RODDICKTON",50.928890,-56.112220,NL,UTC-03:30
02YE001,"GREAVETT BROOK ABOVE PORTLAND CREEK POND",50.160280,-57.579170,NL,UTC-03:30
02YF002,"CAT ARM RESERVOIR NEAR SPILLWAY",50.075000,-56.916110,NL,UTC-03:30
02YG001,"MAIN RIVER AT PARADISE POOL",49.812780,-57.156670,NL,UTC-03:30
02YJ001,"HARRYS RIVER BELOW HIGHWAY BRIDGE",48.575280,-58.363330,NL,UTC-03:30
02YK002,"LEWASEECHJEECH BROOK AT LITTLE GRAND LAKE",48.622220,-57.933330,NL,UTC-03:30
02YK005,"SHEFFIELD BROOK NEAR TRANS CANADA HIGHWAY",49.336390,-56.665550,NL,UTC-03:30
02YK008,"BOOT BROOK AT TRANS-CANADA HIGHWAY",49.266390,-57.103890,NL,UTC-03:30
02YK010,"GRAND LAKE EAST OF GRAND LAKE BROOK",48.670000,-58.079440,NL,UTC-03:30
02YL001,"UPPER HUMBER RIVER NEAR REIDVILLE",49.240550,-57.362500,NL,UTC-03:30
02YL003,"HUMBER RIVER AT HUMBER VILLAGE BRIDGE",48.983890,-57.761390,NL,UTC-03:30
02YL004,"SOUTH BROOK AT PASADENA",49.011940,-57.613060,NL,UTC-03:30
02YL005,"RATTLER BROOK NEAR MCIVERS",49.058310,-58.105190,NL,UTC-03:30
02YL007,"DEER LAKE NEAR GENERATING STATION",49.170000,-57.443050,NL,UTC-03:30
02YL008,"UPPER HUMBER RIVER ABOVE BLACK BROOK",49.619170,-57.294170,NL,UTC-03:30
02YL009,"CORNER BROOK LAKE AT LAKE OUTLET",48.848890,-57.851390,NL,UTC-03:30
02YL011,"COPPER POND BROOK NEAR CORNER BROOK LAKE",48.806640,-57.783830,NL,UTC-03:30
02YL012,"STEADY BROOK ABOVE CONFLUENCE TO HUMBER RIVER",48.953190,-57.827750,NL,UTC-03:30
02YM003,"SOUTH WEST BROOK NEAR BAIE VERTE",49.893610,-56.222780,NL,UTC-03:30
02YM004,"INDIAN BROOK DIVERSION ABOVE BIRCHY LAKE",49.366940,-56.616110,NL,UTC-03:30
02YN002,"LLOYDS RIVER BELOW KING GEORGE IV LAKE",48.242220,-57.828060,NL,UTC-03:30
02YN004,"STAR BROOK ABOVE STAR LAKE",48.627500,-57.311390,NL,UTC-03:30
02YN005,"VICTORIA LAKE AT NORTHEAST CONTROL STRUCTURE",48.357330,-57.115080,NL,UTC-03:30
02YO006,"PETERS RIVER NEAR BOTWOOD",49.105830,-55.410560,NL,UTC-03:30
02YO008,"GREAT RATTLING BROOK ABOVE TOTE RIVER CONFLUENCE",48.827220,-55.530560,NL,UTC-03:30
02YO011,"EXPLOITS RIVER BELOW NOEL PAULS BROOK",48.840830,-56.275830,NL,UTC-03:30
02YO012,"SOUTHWEST BROOK AT LEWISPORTE",49.216110,-55.053050,NL,UTC-03:30
02YO013,"EXPLOITS RIVER AT BADGER",48.974940,-56.034360,NL,UTC-03:30
02YO014,"TRIBUTARY TO GILL'S POND BROOK",48.640580,-56.527830,NL,UTC-03:30
02YO015,"EAST POND BROOK BELOW EAST POND",48.682110,-56.510130,NL,UTC-03:30
02YO016,"EXPLOITS RIVER NEAR MILLERTOWN",48.760080,-56.582420,NL,UTC-03:30
02YO017,"RED INDIAN LAKE AT INDIAN POINT",48.795080,-56.576470,NL,UTC-03:30
02YO018,"EXPLOITS RIVER AT CHARLIES EDWARDS POINT",48.943220,-55.792360,NL,UTC-03:30
02YQ001,"GANDER RIVER AT BIG CHUTE",49.015280,-54.853610,NL,UTC-03:30
02YQ005,"SALMON RIVER NEAR GLENWOOD",49.011390,-54.917500,NL,UTC-03:30
02YR001,"MIDDLE BROOK NEAR GAMBO",48.807780,-54.224450,NL,UTC-03:30
02YR003,"INDIAN BAY BROOK NEAR NORTHWEST ARM",49.040000,-53.883340,NL,UTC-03:30
02YR004,"TRITON BROOK ABOVE GAMBO POND",48.603920,-54.586060,NL,UTC-03:30
02YS003,"SOUTHWEST BROOK AT TERRA NOVA NATIONAL PARK",48.606950,-53.980560,NL,UTC-03:30
02YS005,"TERRA NOVA RIVER AT GLOVERTOWN",48.661950,-54.018050,NL,UTC-03:30
02YS006,"NORTHWEST RIVER AT TERRA NOVA NATIONAL PARK",48.397220,-54.201670,NL,UTC-03:30
02ZA002,"HIGHLANDS RIVER AT TRANS-CANADA HIGHWAY",48.109170,-58.784440,NL,UTC-03:30
02ZB001,"ISLE AUX MORTS RIVER BELOW HIGHWAY BRIDGE",47.613890,-59.009170,NL,UTC-03:30
02ZC002,"GRANDY BROOK BELOW TOP POND BROOK",47.857500,-57.733330,NL,UTC-03:30
02ZC003,"WHITE BEAR RIVER ABOVE BIG INDIAN BROOK",47.806110,-57.388610,NL,UTC-03:30
02ZC004,"GRANITE LAKE AT EAST END",48.181390,-56.931670,NL,UTC-03:30
02ZD002,"GREY RIVER NEAR GREY RIVER",47.743060,-56.934720,NL,UTC-03:30
02ZD003,"R.R. POND NEAR GRANITE LAKE",48.196580,-56.793580,NL,UTC-03:30
02ZE004,"CONNE RIVER AT OUTLET OF CONNE RIVER POND",48.168890,-55.483330,NL,UTC-03:30
02ZF001,"BAY DU NORD RIVER AT BIG FALLS",47.746670,-55.441670,NL,UTC-03:30
02ZG001,"GARNISH RIVER NEAR GARNISH",47.213890,-55.329170,NL,UTC-03:30
02ZG003,"SALMONIER RIVER NEAR LAMALINE",46.874720,-55.777500,NL,UTC-03:30
02ZG004,"RATTLE BROOK NEAR BOAT HARBOUR",47.450550,-54.855000,NL,UTC-03:30
02ZH001,"PIPERS HOLE RIVER AT MOTHERS BROOK",47.946950,-54.285560,NL,UTC-03:30
02ZH002,"COME BY CHANCE RIVER NEAR GOOBIES",47.918610,-53.949720,NL,UTC-03:30
02ZJ001,"SOUTHERN BAY RIVER NEAR SOUTHERN BAY",48.378890,-53.676670,NL,UTC-03:30
02ZJ002,"SALMON COVE RIVER NEAR CHAMPNEYS",48.395830,-53.301670,NL,UTC-03:30
02ZJ003,"SHOAL HARBOUR RIVER NEAR CLARENVILLE",48.206670,-54.039720,NL,UTC-03:30
02ZK001,"ROCKY RIVER NEAR COLINET",47.224720,-53.568330,NL,UTC-03:30
02ZK002,"NORTHEAST RIVER NEAR PLACENTIA",47.273890,-53.842850,NL,UTC-03:30
02ZK003,"LITTLE BARACHOIS RIVER NEAR PLACENTIA",47.181390,-54.040830,NL,UTC-03:30
02ZK004,"LITTLE SALMONIER RIVER NEAR NORTH HARBOUR",47.120830,-53.733330,NL,UTC-03:30
02ZK006,"RATTLING BROOK BELOW BRIDGE",47.414190,-53.807330,NL,UTC-03:30
02ZK007,"RATTLING BROOK BIG POND",47.401610,-53.794970,NL,UTC-03:30
02ZK008,"RATTLING BROOK BELOW PLANT DISCHARGE",47.418610,-53.810110,NL,UTC-03:30
02ZL004,"SHEARSTOWN BROOK AT SHEARSTOWN",47.583890,-53.308060,NL,UTC-03:30
02ZL005,"BIG BROOK AT LEAD COVE",48.042780,-53.082110,NL,UTC-03:30
02ZM006,"NORTHEAST POND RIVER AT NORTHEAST POND",47.635000,-52.837220,NL,UTC-03:30
02ZM008,"WATERFORD RIVER AT KILBRIDE",47.529060,-52.745060,NL,UTC-03:30
02ZM009,"SEAL COVE BROOK NEAR CAPPAHAYDEN",46.847220,-52.974170,NL,UTC-03:30
02ZM016,"SOUTH RIVER NEAR HOLYROOD",47.361390,-53.117220,NL,UTC-03:30
02ZM018,"VIRGINIA RIVER AT PLEASANTVILLE",47.588940,-52.690780,NL,UTC-03:30
02ZM020,"LEARY BROOK AT PRINCE PHILIP DRIVE",47.563330,-52.750000,NL,UTC-03:30
02ZM023,"OUTER COVE BROOK AT CLOVELLY GOLF COURSE",47.626810,-52.708830,NL,UTC-03:30
02ZM024,"OUTER COVE BROOK BELOW AIRPORT",47.616860,-52.730470,NL,UTC-03:30
02ZN002,"ST. SHOTTS RIVER NEAR TREPASSEY",46.708890,-53.490000,NL,UTC-03:30
03NE001,"REID BROOK AT OUTLET OF REID POND",56.373140,-62.161440,NL,UTC-04:00
03NE002,"CAMP POND BROOK BELOW CAMP POND",56.340560,-62.110330,NL,UTC-04:00
03NE011,"REID BROOK BELOW TRIBUTARY",56.305060,-62.092560,NL,UTC-04:00
03NE012,"TRIBUTARY TO REID BROOK",56.306060,-62.094310,NL,UTC-04:00
03NF001,"UGJOKTOK RIVER BELOW HARP LAKE",55.233330,-61.299170,NL,UTC-04:00
03OB004,"JAMES CREEK ABOVE BRIDGE",54.775140,-66.819940,NL,UTC-04:00
03OB006,"GOODREAM CREEK 2KM NORTHWEST OF TIMMINS 6",54.917530,-67.124000,NL,UTC-04:00
03OB007,"ELROSS CREEK BELOW PINETTE LAKE INFLOW",54.877750,-67.099720,NL,UTC-04:00
03OC003,"ATIKONAK RIVER ABOVE PANCHIA LAKE",52.969440,-64.662220,NL,UTC-04:00
03OE001,"CHURCHILL RIVER ABOVE UPPER MUSKRAT FALLS",53.247780,-60.789170,NL,UTC-04:00
03OE012,"CHURCHILL RIVER BELOW GRIZZLE RAPIDS",52.964720,-61.412310,NL,UTC-04:00
03OE013,"CHURCHILL RIVER ABOVE GRIZZLE RAPIDS",52.970080,-61.445390,NL,UTC-04:00
03OE014,"CHURCHILL RIVER 6.15 KMS BELOW LOWER MUSKRAT FALLS",53.237580,-60.675250,NL,UTC-04:00
03OE015,"CHURCHILL RIVER MID POOL",53.243560,-60.776610,NL,UTC-04:00
03PC001,"CHURCHILL RIVER ENGLISH POINT",53.337000,-60.172030,NL,UTC-04:00
03PD001,"LAKE MELVILLE EAST OF LITTLE RIVER",53.589470,-59.478830,NL,UTC-04:00
03QC001,"EAGLE RIVER ABOVE FALLS",53.534170,-57.495000,NL,UTC-04:00
03QC002,"ALEXIS RIVER NEAR PORT HOPE SIMPSON",52.649170,-56.871390,NL,UTC-04:00
03QC003,"ST LEWIS RIVER ABOVE ST LEWIS INLET",52.446860,-56.297580,NL,UTC-04:00
03QC004,"GILBERT RIVER AT OUTLET OF GILBERT LAKE",52.673140,-56.153890,NL,UTC-04:00
04AA003,"BACK LAKE NEAR OXFORD HOUSE",54.941670,-95.247220,MB,UTC-06:00
04AB001,"HAYES RIVER BELOW GODS RIVER",56.431950,-92.788610,MB,UTC-06:00
04AD002,"GODS RIVER NEAR SHAMATTAWA",55.850000,-92.098610,MB,UTC-06:00
04CA002,"SEVERN RIVER AT OUTLET OF MUSKRAT DAM LAKE",53.489420,-91.510330,ON,UTC-05:00
04CA003,"ROSEBERRY RIVER ABOVE ROSEBERRY LAKES",52.655560,-92.537500,ON,UTC-06:00
04CA004,"SEVERN RIVER AT OUTLET OF DEER LAKE",52.673950,-93.991340,ON,UTC-05:00
04CA005,"FLANAGAN RIVER AT OUTLET OF NORTH SPIRIT LAKE",52.526720,-93.053190,ON,UTC-05:00
04CB001,"WINDIGO RIVER ABOVE MUSKRAT DAM LAKE",53.350200,-91.791610,ON,UTC-05:00
04DA001,"PIPESTONE RIVER AT KARL LAKE",52.580550,-90.188890,ON,UTC-05:00
04DA002,"WINISK RIVER AT KANUCHUAN RAPIDS",52.958330,-87.704170,ON,UTC-05:00
04DB001,"ASHEWEIG RIVER AT STRAIGHT LAKE",53.711670,-87.953330,ON,UTC-05:00
04DC001,"WINISK RIVER BELOW ASHEWEIG RIVER TRIBUTARY",54.499720,-87.227780,ON,UTC-05:00
04DC002,"SHAMATTAWA RIVER AT OUTLET OF SHAMATTAWA LAKE",54.289720,-85.651660,ON,UTC-05:00
04EA001,"EKWAN RIVER BELOW NORTH WASHAGAMI RIVER",53.808330,-84.922220,ON,UTC-05:00
04FA001,"OTOSKWIN RIVER BELOW BADESDAWA LAKE",51.899420,-89.258440,ON,UTC-05:00
04FA002,"KAWINOGANS RIVER NEAR PICKLE CROW",51.648310,-89.886920,ON,UTC-05:00
04FA003,"PINEIMUTA RIVER AT EYES LAKE",52.308330,-88.760280,ON,UTC-05:00
04FB001,"ATTAWAPISKAT RIVER BELOW ATTAWAPISKAT LAKE",52.086110,-87.066670,ON,UTC-05:00
04FC001,"ATTAWAPISKAT RIVER BELOW MUKETEI RIVER",53.091390,-85.072220,ON,UTC-05:00
04FC002,"ATTAWAPISKAT RIVER ABOVE LAWASHI",52.932250,-83.367640,ON,UTC-05:00
04FC003,"MUKETEI RIVER NEAR OTOSKWIN-ATTAWAPISKAT RIVER PROVINCIAL PARK",52.866670,-86.240560,ON,UTC-05:00
04GA002,"CAT RIVER BELOW WESLEYAN LAKE",51.166670,-91.597220,ON,UTC-06:00
04GA003,"PASHKOKOGAN RIVER AT OUTLET OF PASHKOKOGAN LAKE",51.037400,-90.197960,ON,UTC-05:00
04GB004,"OGOKI RIVER ABOVE WHITECLAY LAKE",50.866660,-88.930560,ON,UTC-05:00
04GB005,"BRIGHTSAND RIVER AT MORBERLEY",49.631750,-90.571860,ON,UTC-05:00
04GC002,"ALBANY RIVER BELOW ACHAPI LAKE",51.366580,-89.422280,ON,UTC-05:00
04GD001,"ALBANY RIVER ABOVE NOTTIK ISLAND",51.641670,-86.397220,ON,UTC-05:00
04HA001,"ALBANY RIVER NEAR HAT ISLAND",51.330550,-83.833340,ON,UTC-05:00
04HA002,"ALBANY RIVER ABOVE FISHING CREEK ISLAND",51.834860,-83.004670,ON,UTC-05:00
04JC002,"NAGAGAMI RIVER AT HIGHWAY NO. 11",49.772780,-84.536940,ON,UTC-05:00
04JD005,"PAGWACHUAN RIVER AT HIGHWAY NO. 11",49.764170,-85.226110,ON,UTC-05:00
04JD006,"KENOGAMISIS LAKE NEAR GERALDTON",49.692080,-86.881250,ON,UTC-05:00
04JF001,"LITTLE CURRENT RIVER AT PERCY LAKE",50.658300,-86.531940,ON,UTC-05:00
04JG001,"KENAGAMI RIVER NEAR MAMMAMATTAWA",50.421670,-84.380280,ON,UTC-05:00
04KA001,"KWATABOAHEGAN RIVER NEAR THE MOUTH",51.160560,-80.859170,ON,UTC-05:00
04LA002,"MATTAGAMI RIVER NEAR TIMMINS",48.404450,-81.448330,ON,UTC-05:00
04LA003,"TATACHIKAPIKA RIVER NEAR TIMMINS",48.329720,-81.580280,ON,UTC-05:00
04LA004,"MOUNTJOY RIVER NEAR TIMMINS",48.345000,-81.332780,ON,UTC-05:00
04LA005,"MINISINAKWA RIVER NEAR GOGAMA",47.715280,-81.612500,ON,UTC-05:00
04LA006,"MOLLIE RIVER AT HIGHWAY NO. 144",47.496110,-81.848780,ON,UTC-05:00
04LB002,"KAMISKOTIA RIVER ABOVE ENID CREEK",48.626830,-81.628920,ON,UTC-05:00
04LC002,"IVANHOE LAKE NEAR FOLEYET",48.182780,-82.501110,ON,UTC-05:00
04LC003,"IVANHOE RIVER AT FOLEYET",48.250000,-82.443050,ON,UTC-05:00
04LD001,"GROUNDHOG RIVER AT FAUQUIER",49.313890,-82.042810,ON,UTC-05:00
04LE002,"NEMEGOSENDA RIVER NEAR CHAPLEAU",47.938170,-83.060690,ON,UTC-05:00
04LF001,"KAPUSKASING RIVER AT KAPUSKASING",49.413610,-82.438670,ON,UTC-05:00
04LG004,"MOOSE RIVER ABOVE MOOSE RIVER",50.751670,-81.451390,ON,UTC-05:00
04LJ001,"MISSINAIBI RIVER AT MATTICE",49.613890,-83.266670,ON,UTC-05:00
04LK001,"MATTAWISHKWIA RIVER AT HEARST",49.682800,-83.655560,ON,UTC-05:00
